orig,repl
secretariat of the convention to combat desertification,convention to combat desertification secretariat
secretariat of the nairobi convention,united nations environment program
"secretariat of the nairobi convention,",united nations environment program
secretariat of the pacific commission,pacific community
secretariat of the pacific commission (spc);,pacific community
secretariat of the pacific community,pacific community
secretariat of the pacific environment program,pacific regional environment program
secretariat of the pacific regional environment program,pacific regional environment program
secretariat of the pacific regional environment programme,pacific regional environment program
secretariat of the pacific regional environment programme (sprep);,pacific regional environment program
secretariat of the pacific regional environmental programme,pacific regional environment program
secretariat of the regional environment programme of the pacific,pacific regional environment program
secretariat of the south pacific regional environment program,secretariat of the south pacific regional environment program
secretariat of the south pacific regional environment programme,secretariat of the south pacific regional environment program
secretariat to the cartagena convention - un environment caribbean environment programme,united nations environment program
secretariat to the cartagena convention: un environment caribbean environment programme,united nations environment program
sedi: coconino county sustainable economic development initiative (united states),sedi: coconino county sustainable economic development initiative
seecon/cewas;,international center for water management services
seeds- india,seeds india
senai in brazil,senai
senat der wirtschaft,senate of the economy
senckenberg gesellschaft fur naturforschung,senckenberg society for natural research
"senegal (government of),",senegal
"sense international,",sense international
"ser,",society for ecological restoration
servicio holandés de cooperación,dutch cooperation service
"servicios de ideas creativas para el desarrollo de organizaciones, a.c.","creative ideas services for the development of organizations, a.c."
sevastopol national institute for nuclear energy and industry (ukraine),sevastopol national institute for nuclear energy and industry
"sevenseas-media,",sevenseas media
severn trent (united kingdom of great britain and northern ireland),severn trent
seychelles conservation and climate action trust,seychelles conservation and climate adaptation trust
seychelles islands foundation (sif),seychelles islands foundation
sfoi (madagascar),sfoi
sgmtss;,sgmtss
sg's youth envoy's office;,secretary general's youth envoy's office
"shalhaveth freier center for peace, science and technology","shalhaveth freier center for peace, science and technology"
shanghai environmental protection industry association (china),shanghai environmental protection industry association
"share your k-in, s.c.;","share your k-in, s.c."
shaw group (united states),shaw group
shearman & sterling,shearman and sterling
shell foundation (united kingdom of great britain and northern ireland),shell foundation
shenzhen energy-saving association (china),shenzhen energy-saving association
shimshon renewables (india),shimshon renewables
shri jagdamba samiti (india),shri jagdamba samiti
shuraako (ngo),shuraako
"siamdutch mosquito netting co., ltd (thailand)","siamdutch mosquito netting co., ltd"
sida - swedish leadership for sustainable development,swedish leadership for sustainable development
"siemens,",siemens
silsoe research institute (united kingdom of great britain and northern ireland),silsoe research institute
simars m sa de cv (mexico),simars m sa de cv
"simba plastics, ltd. (united republic of tanzania)","simba plastics, ltd."
simex (senegal),simex
"singapore,",singapore
"singapore-eth centre,",singapore-eth centre
"sinocal petroleum technologies, inc. (united states)","sinocal petroleum technologies, inc."
sistema de integración centroamericana - turismo,central american integration system
sistema de la integracion centroamericana,central american integration system
sistema nacional de monitoreo forestal y ambiental,sistema nacional de monitoreo forestal y ambiental
skat (switzerland),skat
slowfood,slow food
small fisheries federation of sri lanka (sudeesa),small fisheries federation of sri lanka
small grants program,global environment facility
small scale sustainable infrastructure development fund,small-scale sustainable infrastructure development fund
smi (united kingdom of great britain and northern ireland),smi
smk university of applied social sciences (smk),smk university of applied social sciences
snv - netherlands development organization,snv netherlands development organization
soangkupon & son,soangkupon and son
soangkupon & son (indonesia),soangkupon and son
social education & environment protection,social education and environment protection
sociedad atlántica de oceanógrafos (sao),oceanographers atlantic society
sociedad audubon de panama,audubon society of panama
sociedad civil,civil society
sociedad de medicina familiar y comunitaria,family and community medicine society
sociedad ecológica de barahona,ecological society of barahona
sociedad espaniola de qimica analitica,spanish society of analytical chemistry
sociedad espaniola de qimica analitica (seqa) (spain),spanish society of analytical chemistry
sociedad peruana de derecho ambiental,peruvian society for environmental law
sociedade francisco soares dos santos,society francisco soares dos santos
sociedade portuguesa de inovao,portuguese innovation society
sociedade pr melhoramentos da vila gilda,society pr improvements of the village gilda
societa botanica italiana,italian botanical company
societa botanica italiana (italy),italian botanical company
societa italiana di biologia marina onlus,italian marine biology society
societa italiana di biologia marina onlus (italy),italian marine biology society
società italiana di statistica,italian statistic society
società italiana di statistica (italy),italian statistic society
société de mathématique appliquées et industrielles,applied and industrial mathematical society
societe d'exploitation du centre national de la mer,operating company of the national center of the sea
societe francaise de biochimie et biologie moleculaire,french society of biochemistry and molecular biology
societe francaise de biochimie et biologie moleculaire (sfbbm) (france),french society of biochemistry and molecular biology
Société Francaise de Biologie Végétale,french society of plant biology
société française de chimie,french chemistry company
société française de chimie (sfc) (france),french chemistry company
societe jaco,jaco society
societe jaco (cameroon),jaco society
société nationale des hydrocarbures,national oil company
societe tunisienne de l'electricite et de gaz,tunisian company of electricity and gas
society for applied microbiology (united kingdom of great britain and northern ireland),society for applied microbiology
society for bird research & nature protection,society for bird research and nature protection
society for protection of animals & nature,society for protection of animals and nature
society for the study of species biology (japan),society for the study of species biology
society of environmental toxicology and chemistry (setac),society of environmental toxicology and chemistry
society of indian automobile manufacturers (india),society of indian automobile manufacturers
society of indian automotive manufacturers,society of indian automobile manufacturers
society of indian automotive manufacturers (siam) (india);,society of indian automobile manufacturers
society of resource geology (japan),society of resource geology
"socrata,",socrata
sojitz corporation (japan),sojitz corporation
solar charger & mobile computing,solar charger and mobile computing
solar charger & mobile computing (soco) (italy),solar charger and mobile computing
solar cookers international (united states),solar cookers international
"solar household energy, inc. (france)","solar household energy, inc."
solar turbines incorporated (united states),catepillar
solare brucke e.v. (germany),solare brucke e.v.
"solben,",solben
soleil de louest,west sun
solomon islands: kustom gaden association;,kustom gaden association
solomon islands;,solomon islands
"somos + decididos, a.c.","we are + determined, a.c."
"somos + decididos, a.c.;","we are + determined, a.c."
somos el presente,we are the present
"somos el presente,",somos el presente
sos atlantic forest,sos atlantic forest foundation
sos children’s villages international,sos children’s villages international
sos children's village,sos children’s villages international
sos childrens villages,sos children’s villages international
sos children's villages,sos children’s villages international
sos foundation atlantic foundation,sos atlantic forest foundation
sosiadad sostenible ac,sustainable society
souffleur decume,decume blowers
souffleurs decume,decume blowers
south african cities network (south africa),south african cities network
south asia cooperative environment program,south asia cooperative environment programme
south asia co-operative environment programme,south asia cooperative environment programme
south east asia ministers of education organization (seameo) (thailand),south east asia ministers of education organization
south pacific regional environment program,secretariat of the south pacific regional environment program
"south pacific regional environment program
environment",secretariat of the south pacific regional environment program
south pacific regional environment programme,secretariat of the south pacific regional environment program
south pacific regional environmental programme,secretariat of the south pacific regional environment program
"south pacific regional program for 
environment",secretariat of the south pacific regional environment program
south pacific tourism organization,south pacific tourism organisation
south province,southern province
south staffordshire water (united kingdom of great britain and northern ireland),south staffordshire water
south west water (united kingdom of great britain and northern ireland),south west water
southern africa hiv & aids information dissemination service,southern africa hiv and aids information dissemination service
southern centre for energy and environment,southern center for energy and environment
southern centre for energy and environment (zimbabwe),southern center for energy and environment
"southern voice,",southern voice
southern water (united kingdom of great britain and northern ireland),southern water
"south-south gate,",South-South Global Assets and Technology Exchange
springer science+business media.,springer science+business media
springer science+business media. (netherlands),springer science+business media
sri lanka -united nations friendship organisation,sri lanka united nations friendship organization
sriracha fisherman's association (thailand),sriracha fisherman's association
"srishti institute of arts, design and technology","srishti school of art, design and technology"
st. vincent and the grenadines electricity services limited private sector.,st. vincent and the grenadines electricity services limited
st.petersburg,st. petersburg
stakeholder forum,stakeholder forum for a sustainable future
stakeholder forum for our common future,stakeholder forum for a sustainable future
stakeholders forum,stakeholder forum for a sustainable future
standard & poor's,standard and poor's
stanford,stanford university
starwood hotels and resorts (united kingdom of great britain and northern ireland),starwood hotels and resorts
state government of selangor (malaysia),state government of selangor
state key laboratory of coal combustion - huazhong university of sciences and technology,huazhong university of sciences and technology
statoil •,statoil
stazione zoologica di napoli (italy),stazione zoologica di napoli
stewart craine (australia),stewart craine
stichting de vliegende meubelmakers,flying furniture makers foundation 
stichting doen aruba,doen foundation
stichting vrouw en arbeidsmarkt,woman and labor market foundation
stiftung alfred-wegener-institut für polar- und meeresforschung (germany),alfred wegener institute
"stm power, inc. (united states)","stm power, inc."
stockholm environment institute;,stockholm environment institute
stockholm international water institute (siwi);,stockholm international water institute
stockholm resilience centre,stockholm resilience center
stokes consulting group for dometic ab (united states),stokes consulting group
"stop gmo pacifique,",stop gmo pacifique
"strathmore university,",strathmore university
streams of knowledge (philippines),streams of knowledge
strengthening rights and equality by empowering teams (street) (pakistan),strengthening rights and equality by empowering teams
sub regional fisheries commission - srfc,sub regional fisheries commission
"sud-comoé,",sud-comoé
sulabh international (india),sulabh international
sulforwanda (rwanda),sulforwanda
sulitest (sustainability literacy tools and community),sulitest
suma khadi gramodyoga sangha (india),suma khadi gramodyoga sangha
sunseed tanzania trust (united kingdom of great britain and northern ireland),sunseed tanzania trust
sunsmile (united states),sunsmile
sunvil (united kingdom of great britain and northern ireland),sunvil holidays limited
susana;,Sustainable Sanitation-Ecosan Program
sustainability watch network (philippines),sustainability watch network
"sustainable development solutions network – youth,",sustainable development solutions network– youth
"sustainable development solutions network (sdsn),",sustainable development solutions network
sustainable energy africa (south africa),sustainable energy africa
sustainable energy for all network,sustainable energy for all
sustainable harvest international (united states),sustainable harvest international
sustainable oceans alliance,sustainable ocean alliance
sustainable technology adaptive research and implementation center (nepal),sustainable technology adaptive research and implementation center
sustainable travel international,sustainable travel international
sustainable travel international (united states),sustainable travel international
"sustentabilidad urbana ideas que transforman, a.c.;","sustentabilidad urbana ideas que transforman, a.c."
sweden.,sweden
swedish centre for nuclear technology,swedish center for nuclear technology
swedish centre for nuclear technology (sweden),swedish center for nuclear technology
swedish geophysical society (sweden),swedish geophysical society
swedish international water institute (siwi) (sweden),swedish international water institute
swedish sida,sweden
swedish society for anthropology and geography (sweden),swedish society for anthropology and geography
"swedish university of agricultural sciences, department of aquatic resources",swedish university of agricultural sciences
"swiso certification pvt. ltd., (india)",swiss cert pvt. Ltd
sylvia earle alliance,sylvia earle alliance/mission blue
sylvia earle alliance / mission blue,sylvia earle alliance/mission blue
syngenta,syngenta corp
syngenta (germany),syngenta corp
syrian arab republic,syria
systembolaget,systembolaget ab
t. r. miles -- technical consultant (united states),t. r. miles -- technical consultant
tableau,tableau foundation
tableau foundation,tableau foundation
taiwan icdf,taiwan international cooperation and development fund
taiwan international cooperation and development fund (icdf),taiwan international cooperation and development fund
talal abu-ghazaleh & co.,talal abu-ghazaleh and co.
tanzania traditional energy development and environment organisation,tanzania traditional energy development and environment organization
tanzania traditional energy development and environment organization (united republic of tanzania),tanzania traditional energy development and environment organization
"tara-expeditions,",tara expeditions foundation
taras shevchenko national university of kiev (ukraine),taras shevchenko national university of kiev
"tarmal industries, ltd. (united republic of tanzania)","tarmal industries, ltd."
tata chemicals limited,tata group
tata consultancy services,tata group
Tata Consulting Engineers,tata group
tata consulting services,tata group
tata institute of fundamental research,tata institute of fundamental research
tata steel,tata group
taylor & francis,taylor and francis
taylor & francis (united kingdom of great britain and northern ireland),taylor and francis
"taylor university,",taylor university
tayna centre for conservation biology,tayna center for conservation biology
"team e-kansai,",team e-kansai
tearfund (united kingdom of great britain and northern ireland),tearfund
"tearfund, (united kingdom of great britain and northern ireland)",tearfund
"tebakor island products ltd ,",tebakor island products ltd
tebtebba (indigenous people's international centre for policy research and education),tebtebba foundation
"tecensys,",tecensys
technical centre of agricultural and rural cooperation,technical center of agricultural and rural cooperation
technical university munich,technical university munich
technical university of sofia (bulgaria),technical university of sofia
technofin consultants private limited (india),technofin consultants private limited
"technologie allianz,",technologie allianz
tecnologica de alimentos s.a.,technological food s.a.
tecnológica de alimentos s.a.,technological food s.a.
teekay shipping norway •,teekay shipping norway
teinainao urban council (tuc),teinainao urban council
teitei taveuni;,teitei taveuni
tela marine research,tela marine research center
television trust for the environment (united kingdom of great britain and northern ireland),television trust for the environment
"te-mana-o-te-moana,",te-mana-o-te-moana
temec (united states),temec
teri (india),the energy research institute
teri university-tu,teri university
terra scientific publishing company (japan),terra scientific publishing company
terrawest energy corp. (canada),terrawest energy corp.
terre des hommes,terres de hommes international federation
terres de hommes international federation,men's land international federation
"tethys-research-institute,",tethys institute
tezpur university (india),tezpur university
thai union europe,thai union
thailand environment institute,thailand environmental institute
thames water (united kingdom of great britain and northern ireland),thames water
the 1% club,1% club
the abdus salam international centre for theoretical physics,abdus salam international centre for theoretical physics
the african cultural exchange,african cultural exchange
the african energy policy research network,african energy policy research network
the african medical and research foundation (amref),african medical and research foundation
the african women's network for community management of forests,african women's network for community management of forests
the afroatlantic theologies & treaties insrtitute,afroatlantic theologies & treaties institute
the afroatlantic theologies & treaties institute,afroatlantic theologies & treaties institute
the alaska native tribal health consortium,alaska native tribal health consortium
the alliance for financial inclusion,alliance for financial inclusion
the american university in cairo,american university in cairo
the arctic council,arctic council
the asia foundation,asia foundation
the association for the conservation of nature in rwanda,association for the conservation of nature in rwanda
the association of environmental education for future generations (aeefg),association of environmental education for future generations
the atlantis diving centre,atlantis diving centre
the australian national centre for ocean resources and security,australian national centre for ocean resources and security
the balaton group,balaton group
the baltic university programme/network,baltic university programme/network
the barbados bankers' association,barbados bankers' association
the barefoot college,barefoot college of india
the benioff ocean initiative,benioff ocean initiative
the bertarelli foundation,bertarelli foundation
the bill & melinda gates foundation,bill and melinda gates foundation
the blue network,blue network
the body shop,body shop
the bridge tank,bridge tank
"the bridge tank,",the bridge tank
the campbell foundation,campbell foundation
the caribbean catastrophe risk insurance facility,caribbean catastrophe risk insurance facility
the catholic agency for overseas development,catholic agency for overseas development
the center for environmental law and community rights advocacy group,center for environmental law and community rights
"the center for oceanic awareness, research, and education","center for oceanic awareness, research, and education"
"the centre for research & technology, hellas","center for research & technology, hellas"
the china green university network,china green university network
the climate reality project canada,climate reality project canada
the climate registry,climate registry
the club of rome,club of rome
the coca cola company,the coca-cola company
the coca-cola foundation,the coca-cola foundation
the commission for environmental cooperation,commission for environmental cooperation
the commission on the protection of the black sea against pollution,commission on the protection of the black sea against pollution
the commons cluster of the un ngo major group,commons cluster of the un ngo major group
the community mangrove forest conservation of baan,community mangrove forest conservation of baan
the confederation of norwegian enterprise,confederation of norwegian enterprise
the confederation of norwegian enterprise •,confederation of norwegian enterprise
the cooperators,cooperators
the creative centre,creative centre
the critical ecosystem partnership fund,critical ecosystem partnership fund
the cropper foundation,cropper foundation
the david and lucile packard foundation,david and lucile packard foundation
the donkey sanctuary,donkey sanctuary
the dow chemical company,dow chemical company
the drammeh institute,drammeh institute
the earth council,earth council
the ecological sequestration trust,ecological sequestration trust
the ecological sequestration trust (test) ecological sequestration fund,the ecological sequestration trust ecological sequestration fund
the endangered wildlife trust,endangered wildlife trust
the energy and resource institute,energy and resources institute
the energy and resources institute,energy and resources institute
the energy institute of uganda,energy institute of uganda
the energy institute of uganda (eiu) (uganda),energy institute of uganda
the european council of vinyl manufacturers,european council of vinyl manufacturers
the european plastics converters,european plastics converters
the european stabiliser producers association,european stabiliser producers association
the explorers club,explorers club
the flying furniture makers foundation ,flying furniture makers foundation 
the foundation for development cooperation,foundation for development cooperation
the gaia-movement trust living earth green world action (the gaia-movement) (switzerland,gaia-movement trust living earth green world action
the geoversiv foundation,geoversiv foundation
the global brain foundation,global brain foundation
"the global challenge award, inc.,","global challenge award, inc."
the global coral reef alliance,global coral reef alliance
the global environment facility (gef) (united states),global environment facility
"the global fund to fight aids, tuberculosis and malaria","global fund to fight aids, tuberculosis, and malaria"
"the global fund to fight aids, tuberculosis, and malaria","global fund to fight aids, tuberculosis, and malaria"
the global ghost gear initiative,global ghost gear initiative
the global mangrove alliance,global mangrove alliance
the global oil and gas industry association for environmental and social issues,global oil and gas industry association for environmental and social issues
the goat dairy,goat dairy
the good group,good group
the gorilla organization,gorilla organization
the government of japan,japan
the graduate union of the university of melbourne,graduate union of the university of melbourne
the great transition initiative,great transition initiative
the green program,green program
the grenada choclate factory,grenada choclate factory
the groundwater foundation,groundwater foundation
the groundwater foundation (united states),groundwater foundation
the guard foundation,guard foundation
the high seas alliance,high seas alliance
the hongkong and shanghai banking corporation,hongkong and shanghai banking corporation
the hope of tomorrow,hope of tomorrow
the hope project,hope project
the hr advisor,hr advisor
the hunger project,hunger project
the independent association of prep schools,independent association of prep schools
the innovation hub,innovation hub
"the innovation hub,",innovation hub
the institute for sustainable development and research,institute for sustainable development and research
the institute of higher global studies,institute of higher global studies
"the institute of oceanography, viet nam academy of science and technology",vietnam academy of science and technology
the international council for the exploration of the sea (ices),international council for the exploration of the sea
the international federation of gynecology and obstetrics,international federation of gynecology and obstetrics
the international federation of medical students' associations,international federation of medical students' associations
the international health awareness network,international health awareness network
