orig,repl
"), care international,",care international
", accur8africa,",accur8africa
", ceará,",ceará
", cepei,",cepei
", data2x,",data2x
", décider ensemble, durapole,",décider ensemble
", escap,",escap
", national bureau of statistics (nbs) - tanzania,",tanzania
", oxford poverty and human development initiative (ophi),",oxford poverty and human development initiative
", partnership in statistics for development in the 21st century (paris21),",partnership in statistics for development in the 21st century
", real impact analytics,",real impact analytics
", sdg philanthropy platform,",sdg philanthropy platform
", south australia,",south australia
", telefonica,",telefonica
", transparency international,",transparency international
", world bank group,",world bank
; cap-net united nations development program,united nations development program
; energy research center netherlands (ecn) (netherlands);,energy research center of the netherlands
; ina;,general directorate of qualification of public employees
"; kiribati: k-organic producers,",k-organic producers
; nrg4sd - network of subnational governments for sustainable development,network of subnational governments for sustainable development
; organisation of eastern caribbean states (oecs);,organization of eastern caribbean states
18. university of hawai‘i (uh),university of hawai'i
22. hawai‘i green growth (hgg) - coordinator,hawai'i green growth
23. agricultural leadership foundation of hawai?i,agricultural leadership foundation of hawaii
24. blue planet foundation,blue planet foundation
25. coordinating group on alien pest species,coordinating group on alien pest species
26. enterprise honolulu,Oahu Economic Development Board
28. harold k.l. castle foundation,harold k.l. castle foundation
29. hau‘oli mau loa foundation,hau'oli mau loa foundation
3. county of hawai‘i,county of hawai'i
35. kamehameha schools,kamehameha schools
350 pacific climate warriors,350.org
350org.,350.org
37. kaua‘i action & planning alliance,kaua‘i action and planning alliance
3m canada,3m
40. m?lama hawai‘i,m?lama hawaii
41. m?lama learning center,m?lama learning center
42. m?lama maunalua,m?lama maunalua
43. national tropical botanical garden,national tropical botanical garden
44. pacific islands climate change cooperative,pacific islands climate change cooperative
45. polynesian voyaging society,polynesian voyaging society
47. slow food hawai’i,slow food hawaii
48. sustain hawai’i,sustain hawaii
49. tri-isle resource conservation & development,tri-isle resource conservation and development
5. county of maui,county of maui
50. the nature conservancy of hawai’i,nature conservancy
51. world conservation congress 2016 - hawai’i committee business,international union for conservation of nature
52. accord 3.0 consultants,accord 3.0 consultants
53. hawaiian electric company,hawaiian electric company
54. kyo-ya/starwood hotels,starwood hotels and resorts
"55. sustainability partners, inc.","sustainability partners, inc."
"56. susty pacific, llc","susty pacific, llc"
57. town restaurant,town restaurant
58. pineapple tweed public relations & marketing,pineapple tweed public relations and marketing
aal;,academic association of lisbon
aapeq,agro-fishing eco-tourist association of quebro
abae;,blue flag association for europe
abb,abb group
abb oy,abb group
abdus salam institute for theoretical physics,abdus salam international centre for theoretical physics
abeta: associação brasileira das empresas de turismo de aventura,brazilian association of adventure tourism companies
abeta: associação brasileira das empresas de turismo de aventura (brazil),brazilian association of adventure tourism companies
"abia state, nigeria",abia state
abinbev,ab inbev
abn amro,abn amro bank nv
abn amro bank nv (united kingdom of great britain and northern ireland),abn amro bank nv
abril,april
académie des sciences de france,french academy of sciences
académie des sciences de france (france),french academy of sciences
academy for educational development (aed) (united states),academy for educational development
academy for technological innovation & research,academy for international science and research
academy of preventive medicine (china),china
acb - réseau des bretons d'influence,breton network of influence
"acb - réseau des bretons d'influence,",acb - réseau des bretons d'influence
accra metropolitan assembly,accra
"acidd,",acidd
action d'etude et de valorisation de l'environnement,action of study and valuation of the environment
action d'etude et de valorisation de l'environnement (aceve),action of study and valuation of the environment
action solidarit tiers monde,third world solidarity
actionaid,actionaid international
acuario nacional,dominican republican national aquarium
adama science & technology university (ethiopia);,adama science and technology university
adsorptech inc (united states),adsorptech inc
advent development and relief agency,adventist development and relief agency
adventist development relief agency,adventist development and relief agency
adventist disaster relief agency,adventist development and relief agency
aea technology plc (united kingdom of great britain and northern ireland),aea technology plc
"aea technology,",aea technology plc
aepsa;,association of portuguese companies for the environment sector
afp,agence france-presse
afrepren,african energy policy research network
afrepren/fwd,african energy policy research network
afrepren/fwd (kenya),african energy policy research network
"africa gathering,",africa gathering
"africa, caribbean and the pacific secretariat","african, caribbean and pacific group of states secretariat"
"africa, caribbean, pacific","african, caribbean and pacific group of states secretariat"
african centre for technology studies,african center for technology studies
"african centre for technology studies (acts),",african center for technology studies
african centre of meteorological applications for development,african center of meteorological applications for development
"african development bank (adb),",african development bank
african development bank group,african development bank
"african development bank,",african development bank
"african development fund,",african development fund
african forum for utility regulators (afur) (south africa),african forum for utility regulators
african union commission (auc),african union
african union commission auc,african union
"african union commission,",african union
afroatlantic theologies & treaties insrtitute,afroatlantic theologies & treaties institute
afton chemicals (united states),afton chemicals
aga khan foundation,aga khan development network
aga khan foundation portugal;,aga khan development network
aga khan planning and building service (pakistan),aga khan development network
aga khan university (pakistan),aga khan university
agama energy (south africa),agama energy
agence de l’eau rhône méditerranée corse (aermc) (government),rhône méditerranée corse water agency
agence internationale pour le développement de l'information environnementale,international agency for the development of environmental information
agence universitaire de la francophonie,university agency of la francophonie
agencia internacional de cooperación y desarrollo,international cooperation and development agency
agency for rational energy use and ecology (ukraine),agency for rational energy use and ecology
agenzia per la promozione della ricerca europea,agency for the promotion of european research
"agora,",agora
"agreement on the conservation of small cetaceans of the baltic, north east atlantic, irish and north seas (ascobans),",ascobans
agricultural development institute (adi),agricultural development institute
agricultural economics society (united kingdom of great britain and northern ireland),agricultural economics society
agricultural resesarch council,agricultural research council
agrimat and transcol (ghana),agrimat
agrinergy ltd (united kingdom of great britain and northern ireland),agrinergy ltd
agrivet (madagascar),agrivet
agro campus quest,agrocampus ouest
aidafrica (united states),aidafrica
"aiddata,",aiddata
aides et actions,aid and actions
aiesec,aiesec international
aiesec;,aiesec international
"aimst university,",aimst university
aiso (academia de innovacion para la sostenibilidad),academy of innovation for sustainability
akadémiai kiadó,academic publisher
akadémiai kiadó (hungary),academic publisher
alam lestari,sustainable nature
alaska permanent fund,alaska permanent fund corporation
albemarle,albemarle
albion,albion farms and fisheries
albion fisheries research center,albion fisheries research centre
"alchem field services, inc. (united states)","alchem field services, inc."
alexander von humboldt institute,alexander von humboldt biological resources research institute
alfred-wegener-institut,alfred wegener institute
alianza verde,green alliance
alianza verde (guatemala),green alliance
all-china youth federation (china),all-china youth federation
alliance des pcheurs professionnels du qubec,alliance of quebec professional fishermen
alliance francaise,french alliance
alliance maghreb pour l'eau,maghreb alliance for water
alliance of automobile manufacturers (united states),alliance of automobile manufacturers
alliance to save energy (united states),alliance to save energy
"almae,",almae
almeda,almeida
altis-università cattolica del sacro cuore,altis-catholic university of the sacred heart
"amambay,",amambay
amathus holidays,amathus holidays
"american chemical society, division of chemical health and safety (united states)",american chemical society
american college of obstetricians & gynaecologists,american college of obstetricians and gynecologists
american council on renewable energy (acore) (united states),american council on renewable energy
american feline practitioners association (united states),american feline practitioners association
american institute of chemical engineers (aiche) (united states),american institute of chemical engineers
american microscopical society (united states),american microscopical society
american petroleum institute (united states),american petroleum institute
american physiological society (united states),american physiological society
american society of naturalists (united states),american society of naturalists
american society of plant biologists (united states),american society of plant biologists
american university in cairo;,american university in cairo
amt für wirtschaft und tourismus graubünden,graubünden
anatomical society of great britain and ireland (united kingdom of great britain and northern ireland),anatomical society of great britain and ireland
andean development corporation – development bank of latin america,development bank of latin america
anglo coal australia,anglo american plc
annual reviews (united states),annual reviews
anse la raie vmca committee,reef conservation society
appropriate rural technology institute (india),appropriate rural technology institute
aprotech asia (philippines),Asian Alliance of Approprate technology Practitioners
aprovecho research center (united states),aprovecho research center
aquario,aquarium
aquario de ubatuba,ubatuba aquarium
ar now! (philippines),ar now!
araucanía.,araucanía
"arcadis us, inc.","arcadis us, inc."
areas protegidas y vida silvestre roatan marine park,protected areas and wildlife roatan marine park
arf - association des régions de france,association of french regions
"arf - association des régions de france,",association of french regions
"argentina 
geoestudios",argentina geoestudios
arm,arm technology
armada dominicana,dominican republic
"armateurs de france,",armateurs de france
arrecifes saludables,healthy reefs initiative
artisanal gold council,artisanal gold council
asean,association of southeast asian nations
asean secretariat,association of southeast asian nations
asia development bank  ,asian development bank
asia development bank (philippines),asian development bank
"asia pacific association of medical journal editors (apame),",asia pacific association of medical journal editors
asia pacific network for global change research sustainable development solutions network,asia pacific network for global change research
asia regional cookstove program (philippines),asia regional cookstove program
asian clean fuels association (singapore),asian clean fuels association
"asian development bank,",asian development bank
asian network for higher education in nuclear technology (republic of korea),asian network for higher education in nuclear technology
asian ngo coalition for agrarian reform and rural development (angoc) (philippines),asian ngo coalition for agrarian reform and rural development
asian productivity organisation,asian productivity organization
"asian productivity organization, tokyo, japan",asian productivity organization
asia-pacific economic coordination,asia-pacific economic cooperation
asja ambiente italia s.p.a. (italy),asja ambiente italia s.p.a.
asociacin costa rica por siempre,costa rica forever association
asociacin de artesanos y servicios marinos,association of craftsmen and marine services
asociacin de cangrejeros - santa teresa,association of crabbers - santa teresa
asociacin de hoteles y restaurantes de sosa y cabarete,association of hotels and restaurants of sosua and cabarete
asociacin de pescadores de juanillo,juanillo fishermen's association
asociacin de productores agropecuarios jambeli,association of agricultural producers jambeli
asociacin de productores de sal - asprosal,association of salt producers - asprosal
asociacin oceanogrfica del uruguay,oceanographic association of uruguay
"asociacin para el uso, manejo y conservacin del manglar palmar","association for the use, management and conservation of the palmar mangrove"
asociacin virgen de guadalupe,virgin association of guadalupe
asociacio?n de biotecnologi?a vegetal agri?cola,agricultural plant biotechnology association
asociación agro pesca eco-turístico de quebro,agro-fishing eco-tourist association of quebro
asociación agro-ecoturística el espavé - eben ezer,agro-ecotourism association of wild cashews - eben nada
asociación amigos del parque marino de roatán (roatán marine park),friends of the roatán marine park association
asociación argentina de médicos por el medio ambiente,argentine association of doctors for the environment
asociación argentina de médicos por el medio ambiente (aamma),argentine association of doctors for the environment
asociacion caguama,loggerhead association
asociacion camara de pesca turstica de guanacaste,guanacaste chamber of tourism
asociacion chajulense val vaq'chujol,chajulense union association
"asociación civil estudios y proyectos, argentina","civil association studies and projects, argentina"
asociacion club amateur de pesca,amateur fishing club association
asociacion comunitaria de baha malaga,community association of baha malaga
asociación comunitaria de bahía málaga - ecomanglar - santiago valencia,ecomanglar
asociación conferencia de iglesias evangélicas de guatemala,association conference of evangelical churches of guatemala
asociacion de biologia marina,marine biology association
asociación de cámaras de tecnología agropecuaria,chamber of agricultural technology association
asociación de campesinos unidos para el desarrollo de bahía honda,association of united peasants for the development of bahia honda
asociación de desarrollo sostenible de sosúa,sosúa sustainable development association
asociación de dueños de barcos de samaná,association of boat owners of samaná
asociación de fundaciones empresariales,association of business foundations
asociacion de hoteles y restaurantes de sosa y cabarete,association of hotels and restaurants of sosua and cabarete
asociación de pequeños productores agropecuarios visión integral (santa elena).,association of small agricultural producers integral vision
asociacion de pequenos productores de talamanca,association of small producers of talamanca
asociacion de pesca turistica costarricense,costa rican fishing federation
asociacion de pescadores de pesca turistica de flamingo,association of fishing fishermen of flamingo
asociacion de pescadores del litoral del san juan,association of fishermen of the coast of san juan
asociacion de remo y canotaje de puerto plata,rowing and boating association of puerto plata
asociacion deportiva club nacional de pesca,sports association national fishing club
asociacion desarrollo puerto plata,puerto plata development association
asociacion ecologica herencia ambiental,environmental heritage ecological association
asociacion equipo ecolgico natal ecomanglar,ecomanglar
asociacion hondurena para el desarollo,honduran association for the development of technical and financial services
asociacion hondurena para el desarollo (honduras),honduran association for the development of technical and financial services
asociacion latinoamericana de operadores de agua y saneamiento,latin american association of water and sanitation operators
"asociación mexicana de ex-participantes del barco mundial de la juventud, a.c.",mexican association of ex-participants of the world youth boat
asociacion mujeres ebano,ebony women's association
asociacion nacional de empresas de agua y saneamiento,national association of water and sanitation companies
asociación nacional de empresas de agua y saneamiento de méxico,national association of water and sanitation companies of mexico
asociacion nacional de operadores de transportes acuaticos de quepos,national association of aquatic transport operators of quepos
asociacion nacional para la conservacin de la naturaleza,national association for the conservation of nature
asociación nacional para la conservación de la naturaleza,national association for the conservation of nature
asociacion nautica de tamarindo,tamarindo nautical association
asociación nicaragüense de turismo receptiva,nicaraguan association of receptive tourism
"asociación para la conservación, investigación de la biodiversidad y el desarrollo sustentable –","partnership for conservation, biodiversity research and sustainable development"
asociación para la organización y educación empresarial femenina de el salvador (el salvador),association for the organization and business education of women in el salvado
asociacion peruana de escultismo,peruvian association of scouting
asociacion playa dorada,golden beach association
asociation de empresas para el ahorro de la energria en la edificacion a.c. (aeaee) (mexico),alliance for energy efficiency
asr: alliance of independent travel traders (germany),alliance of independent travel traders
assemblée parlementaire de la francophonie,parliamentary assembly of la francophonie
assoc. of european automobile manufacturers (aeca) (belgium),association of european automobile manufacturers
associação brasileira de agua e energia,brazilian association of water and energy
associação brasileira de biotecnologia industrial,brazilian association of industrial biotechnology
associação brasileira de cimento portland,brazilian portland cement association
associação brasileira dos profissionais de sustentabilidade,brazilian association of sustainability professionals
associação de desenvolvimento territorial de santa catarina,territorial development association of santa catarina
associação mato-grossense dos municípios,mato-grossense association of municipalities
associacão nacional dos carroceiros e catadores de materiais reciclãveis,national association of carriers and waste pickers
associação shared services & outsourcing platform,association shared services and outsourcing platform
associacio catalana de tecnics de climatitzacio i refrigeracio,catalan association of air conditioning and refrigeration technicians
associacion centro de investigacion cooperativa en nanociencias,association cooperative research center in nanosciences
associación de pedagogos de cuba,association of cuba pedagogues
associacion semilleros argentinos,argentine seedling association
associao caboverdiana de ecoturismo,cape verdean ecotourism association
"associao comunitria para o desenvolvimento do morrinho,",community association for the development of morrinho
associao de defesa e educao ambiental adea,defense association and environmental education adea
associao dos jovens com iniciativa empresarial,association of young people with entrepreneurship
associao ecolgica joinvillense - vida verde,ecological association joinvillense - green living
associao itapaoense de surf,surfing association itapaoense
associao movimento socioambiental caminho das guas,socio-environmental movement path of water
associao varandinha de povoao velha,beautiful association of povoao velha
association aide aux femmes et enfants,association helps women and children
association ardito desio,bold desio association
association belge des eco-conseillers et des conseillers en environnement,belgian association of eco-advisers and environmental advisers
association bio caledonia,caledonian association of biological certification
association burundaise pour la protection de la nature,burundian association for the protection of nature
"association burundaise pour le developpement rural ""face a la malnutrition et la pauvrete""","burundian association for rural development ""facing malnutrition and poverty"""
association d'aide au développement économique et communautaire.,association for economic and community development assistance
association de developpement et de protection de l'environnement- la marsa,association for the development and protection of the environment - la marsa
association de gestion integree des ressources,integrated resource management association
association de lutte contre le sida,aids association
association des ecomaires,eco-friendly association
"association des ecomaires,",eco-friendly association
association des jeunes solidaires de l'afrique,solidarity youth association of africa
association des pcheurs prof. des iles des mad.,fishmeran owners association of the islands of madeline
association des scientifiques environnementalistes pour un dveloppement,association of environmental scientists for development
association d'etude et de mise en valeur des ressouces naturelles et des institutions,association for the study and development of natural resources and institutions
association d'etude et de mise en valeur des ressouces naturelles et des institutions (aserni),association for the study and development of natural resources and institutions
association du sahel d'aide à la femme et à l'enfance,sahel association of assistance to women and children
association for emission control by catalyst (belgium),association for emission control by catalyst
association for responsible mining (arm),alliance for responsible mining
association for the study of animal behavior (united kingdom of great britain and northern ireland),association for the study of animal behavior
association for unification of law in africa (unida),association for unification of law in africa
association guineenne des femmes chercheurs,guinean association of women researchers
association ingénieurs sans frontières,engineers without borders - france
"association merterre,",association merterre
association monegasque pour la protection de la nature,monegasque association for the protection of nature
association of american geographers (united states),association of american geographers
association of applied biologists (united kingdom of great britain and northern ireland),association of applied biologists
association of australian palaeontologists (aap) (australia),geological society of australia
association of caribbean states - caribbean sea comission,association of caribbean states
association of chemistry and the environment (united kingdom of great britain and northern ireland),association of chemistry and the environment
association of family and corporate foundations (afe),association of family and corporate foundations
association of field ornithologists (united states),association of field ornithologists
association of generators with renewable energy - ager (guatemala),association of generators with renewable energy
association of independent travel agents,association of independent travel agents
association of intl. automobile manufacturers (united states),association of international automobile manufacturers
association of lighting and mercury recyclers (almr),association of lighting and mercury recyclers
association of southeast asian nations (asean) working group (singapore),association of southeast asian nations
"association of veterinary anaesthetists, (united states)",association of veterinary anaesthetists
association technique internationale des bois tropicaux,international technical association of tropical timber
association universitaire pour l'environnement,university association for the environment
associazione italiana amici di raoul follereau,italian association friends of raoul follereau
associazione malttie da intossicazione cronica e/o ambientale,association for diseases caused by chronic and / or environmental intoxication
associazione malttie da intossicazione cronica e/o ambientale (a.m.i.c.a),association for diseases caused by chronic and / or environmental intoxication
associazione per la solidarietà internazionale in asia,association for international solidarity in asia
ata (brazil),ata
"ateneo nacional de la juventud, a.c.","national athenaeum of youth, a.c."
"ateneo nacional de la juventud, a.c.;","national athenaeum of youth, a.c."
atkins,atkins global
atlas copco drilling solutions inc (united states),atlas copco drilling solutions inc
atomic institute of austrian universities,atomic institute of austrian universities
