orig,repl
lextran,lextran
"lfg technologies, inc. (united states)","lfg technologies, inc."
Licensing Executives Society International,licensing executives society international
liege university,university of liege
"lifebuilders of nigeria,",lifebuilders of nigeria
"light for the world,",light for the world
ligue de l'enseignement,league of education
likhang kabitenyo foundation (philippines),likhang kabitenyo foundation
"liliane fonds,",liliane fonds
"limestone partners, llc (united states)","limestone partners, llc"
linnean society of london (united kingdom of great britain and northern ireland),linnean society of london
lipor;,intermunicipal service for waste management in greater porto
"liu, shen & associates","liu, shen and associates"
live & learn environmental education,live and learn environmental education
living oceans society (ngo);,living oceans society
"living-oceans-society,",living oceans society
lneg;,national laboratory of energy and geology
local federation from closing of niodior (felogie niodior),local federation from closing of niodior
locally-managed marine area network,locally managed marine area network
"lombardia,",lombardia
london asia capital (china),london asia capital
london school of hygiene & tropical medicine,london school of hygiene and tropical medicine
london school of hygiene and tropical medicine (lshtm) (united kingdom of great britain and northern ireland),london school of hygiene and tropical medicine
los gatos research (united states),los gatos research
louis berger group (united states),louis berger group
low carbon cities initiative (united kingdom of great britain and northern ireland),low carbon cities initiative
low carbon development & promotion centre,low carbon development and promotion center
lpg association of southern africa (south africa),lpg association of southern africa
lpn;,league for the protection of nature
lubrizol corporation (united states),lubrizol corporation
ludvik group,ludvik electric
lush,lush cosmetics
m s swaminathan research foundation,m. s. swaminathan research foundation
m/s tce consulting engineers ltd. (india),tata group
macarthur foundation,john d. and catherine t. macarthur foundation
macedonian center for energy efficiency (mppm) (the former yugoslav republic of macedonia),macedonian center for energy efficiency
macquarie university,macquarie university
madina tank ltd.,madina tank ltd.
"mae fah luang university,",mae fah luang university
maersk oil & gas,maersk oil and gas
"mahidol university,",mahidol university
mahidul university,mahidol university
"mahiti infotech pvt ltd,",mahiti infotech pvt ltd
maik nauka interperiodica (russian federation),maik nauka interperiodica
"mairie de grand-lahou,",mairie de grand-lahou
makerere university school of public health,makerere university
malama maunalua,m?lama maunalua
malaria consortium (united kingdom of great britain and northern ireland),malaria consortium
malaysia nature society,malaysian nature society
malaysia nature society (malaysia),malaysian nature society
"malaysia,",malaysia
mali folkecenter (mali),mali folkecenter
mammal society (united kingdom of great britain and northern ireland),mammal society
manufacturers of emission control assoc (meca) (united states),manufacturers of emission control association
manus provincial administration.,manus provincial administration
mar fund,mar fund
margaret a cargill philanthropies,margaret a. cargill philanthropies
margaret a. cargill foundation,margaret a. cargill philanthropies
marine conservation biology institute,marine conservation institute
"marine environment and resources foundation, inc. (ngo)","marine environment and resources foundation, inc."
marine hydrophysical institute of the ukrainian academy of sciences (ukraine),marine hydrophysical institute of the ukrainian academy of sciences
marine research centre,marine research center
"marine science institute, univ. of the philippines (philippines)",university of the philippines
"marine-conservation-institute,",marine conservation institute
maritime battery forum •,maritime battery forum
marks & spencer,marks and spencer
marks & spencer’s,marks and spencer
"mars omega llp,",mars omega llp
marthe van rijswijck foundation;,marthe van rijswijck foundation
marti,mesoamerican reef tourism initiative
martin-luther-universität halle-wittenberg,martin luther university halle wittenberg
masdar,masdar city
mass media (vietnam),mass media
massachusetts renewable energy trust (united states),massachusetts
massachussets institute of technology,massachusetts institute of technology
"mastercard,",mastercard
mata amritanandamayi mata (ma math) (india),mata amritanandamayi mata
mauritiana,mauritania
mauritius marine consersation society,mauritius marine conservation society
max & marjorie fisher foundation,max and marjorie fisher foundation
max chemicals (india),max chemicals
mccann health,mccann healthcare
mccann-erickson,mccann healthcare
mckinsey & company,mckinsey and company
"mckinsey & company,",mckinsey & company
medical university of south carolina (united states),medical university of south carolina
mediterranean action plan/barcelona convention,mediterranean action plan
mediterranean agronomic institute of bari (ciheam-mai bari);,mediterranean agronomic institute of bari
mediterranean energy and ecology center (israel),mediterranean energy and ecology center
"mediterranean information office for environment, culture, and sustainable development","mediterranean information office for environment, culture and sustainable development"
mediterranean network of basin organisations,mediterranean network of basin organizations
mediterranean renewable energy centre regional centre,mediterranean renewable energy center regional center
medknow publishers (united states),medknow publishers
megapak (south africa),nampak
megtec systems (sweden),megtec systems
mekong river commission (cambodia),mekong river commission
menschen für menschen,people for people
mercotur: soluções inteligentes para o turismo sustentável,mercotur: smart solutions for sustainable tourism
mercotur: soluções inteligentes para o turismo sustentável (brazil),mercotur: smart solutions for sustainable tourism
mercuriados,mercuriados
"merzbach group, llc (united states)","merzbach group, llc"
"met office hadley centre, uk","met office hadley center, uk"
metameta;,metameta
"métamorphose outremers,",métamorphose outremers
metro ag wholesale & food specialist company,metro ag wholesale and food specialist company
"mexico (government of),",mexico
mgm international (united states),mgm international
"mhii solutions,",mhii solutions
miambiente,miambiente
"microsoft schweiz,",microsoft
middlesbrough city council,middlesbrough
midkent water (united kingdom of great britain and northern ireland),South East Water Ltd
millipore foundation (united states),millipore foundation
mindanao state university philippines,mindanao state university
mindanao state university philippines.;,mindanao state university
minerales monclova s.a. de c.v. (mexico),minerales monclova s.a. de c.v.
mineresearch,mineresearch
ministère de la transition écologique et solidaire (chargé de la mer),france
ministerio de agricultura ganaderia y alimentacion,ministerio de agricultura ganaderia y alimentacion
ministerio de ambiente de panama,panama
ministerio de ambiente y recursos naturales,ministerio de ambiente y recursos naturales
ministerio de medio ambiente,dominican republic
ministerio de medio ambiente y recursos naturales,dominican republic
ministre de lenvironnement et de dveloppement durable,cote d'ivoire
ministry of climate and environment •,ministry of climate and environment
ministry of climate change and environment,united arab emirates
ministry of environment,czech republic
ministry of environment (czech republic),czech republic
ministry of environment albania,albania
"ministry of fisheries and agriculture, maldives",maldives
ministry of foreign affairs and cooperation,monaco
ministry of marine affairs and fisheries,indonesia
ministry of natural resources and environment,samoa
"ministry of ocean economy, marine resources, fisheries & shipping (shipping division) of the republic of mauritius",mauritius
ministry of resources & development (marshall islands marine resources authority),marshall islands
ministry of sea,portugal
"ministry of sustainable development and tourism, department for sustainable development and integrated coastal zone management",montenegro
ministry of trade and fisheries •,ministry of trade and fisheries
minstry of industries and innovation on behalf of the government of iceland,iceland
miriam college (philippines),miriam college
"mission-blue,",mission-blue
"missions publiques,",missions publiques
mit press (united states),mit press
mitcon consultancy services ltd (india),mitcon consultancy services ltd
"mitsubishi heavy industries, ltd.",mitsubishi chemical holdings corporation
"mitsubishi heavy industries, ltd. (japan)",mitsubishi chemical holdings corporation
mitsui & co.,mitsui and company
"mitsui mining engineering co., ltd.",mitsui and company
"mitsui mining engineering co., ltd. (japan)",mitsui and company
mizuho corporate bank (united states),mizuho corporate bank
"moana nui,",moana nui
monaco explorations,monaco
"monaco,",monaco
monde volontaire au développement,voluntary world of development
"monde volontaire au développement,",voluntary world of development
montecristo river lodge (nicaragua),montecristo river lodge
monterey bay aquarium on behalf of all partners,monterey bay aquarium
monterey bay aquarium research institute,monterey bay aquarium
monterey bay aquarium seafood watch,monterey bay aquarium
"monterey bay aquarium seafood watch (ngo),",monterey bay aquarium
monterrey bay aquarium,monterey bay aquarium
morocco (government of),morocco
"morona santiago,",morona santiago
morroco,morocco
morse associates inc. (mai) (united states),morse associates inc.
moscow engineering physics institute (russian federation),moscow engineering physics institute
mossnet (ghana),mossnet
"motivation,",motivation
mouchel parkman group (united kingdom of great britain and northern ireland),mouchel parkman group
mountain societies development support programme,mountain societies development support program
mouvement international des etudiants catholiques,international movement of catholic students
mouvement solidarité humanitaire alfityanu luxembourg,humanitarian solidarity movement alfityanu luxembourg
movimento dos pescadores e pescadoras - mpp,fishermen and fishermen's movement
movimiento nueva generación,new generation movement
movimiento unido por la infancia en méxico,united movement for childhood in mexico
movimiento unido por la infancia en méxico;,united movement for childhood in mexico
mozamibque,mozambique
mpa action agenda & mpa action group,mpa action agenda and mpa action group
ms swaminathan research foundation,m. s. swaminathan research foundation
munich climate insurance initiative (mcii);,munich climate insurance initiative
municipality of xinjiang uygur autonomous region (china),municipality of xinjiang uygur autonomous region
municipio de panama,panama city
museo nacional de ciencias naturales,national museum of natural sciences
museo nacional de historia natural,national museum of natural history
my world mexico,my world mexico
mycological society of japan (jamaica),mycological society of japan
"myright,",myright
mytravel uk (united kingdom of great britain and northern ireland),mytravel uk
"nabbir laboratory (kl) sdn. bhd.,",nabbir laboratory (kl) sdn. bhd.
naima canada (canada),naima canada
nairobi convention secretariat,nairobi convention
nampo city government (democratic people's republic of korea),nampo city government
"napa ii and fisheries department, tuvalu",tuvalu
"napo,",napo
nat (naturally advanced technologies),naturally advanced technologies
"national academy of sciences, the (united states)",national academy of sciences
national association of automobile manufacturers of south africa - naamsa (south africa),national association of automobile manufacturers of south africa
national association of state energy officials (naseo) (united states),national association of state energy officials
national atmospheric deposition program,university of illinois
national autonomous university of honuras,national autonomous university of honduras
national autonomous university of mexico (mexico),national autonomous university of mexico
national business initiative (nbi),national business initiative
national cceanographic data denter of the comoros,national oceanographic data denter of the comoros
"national center for transportation studies (ncts), philippines (philippines);",national center for transportation studies
national defence university of malaysia.,national defence university of malaysia
national geographic,national geographic society
national institute for water and atmospheric research,national institute of water and atmospheric research
national land committee (nlc) (south africa),national land committee
national lighting test centre,national lighting test center
national lighting test centre of china,national lighting test center
"national organisation for development (palestian territory, occupied)",national organisation for development
national planning commission secretariat (nepal),nepal
national research council,italy
"national science centre ""kharkov institute of physics and technology""","national science center ""kharkov institute of physics and technology"""
"national science centre ""kharkov institute of physics and technology"" (ukraine)","national science center ""kharkov institute of physics and technology"""
national taitung university (china),national taitung university
national technical university of ukraine kiev polytechnic institute (ukraine),national technical university of ukraine kiev polytechnic institute
national termite prevention and control (china),national termite prevention and control
national union of students,national union of students of the united kingdom
national univeristy of samoa,national university of samoa
natsource group (united states),natsource group
"natural resource governance institute (nrgi),",natural resource governance institute
natural resources defense council (nrdc),natural resources defense council
natural resources defense council (united states),natural resources defense council
naturaleza y cultura internacional,nature and international culture
nature conservancy of hawaii,nature conservancy
nature publishing group (united kingdom of great britain and northern ireland),nature publishing group
nature seychelles (seychelles),nature seychelles
nausicaà,nausicaa
ndanifor gardens uk,ndanifor gardens uk trust
nederlands instituut voor zeeonderzoek,netherlands
nedindo (indonesia),nedindo
nedwa (mauritania),nedwa
neilson (united kingdom of great britain and northern ireland),neilson
nepad,african union
nepad planning and coordination agency (npca / nepad agency),african union
nepal water for health (newah) (nepal),nepal water for health
nestle,nestlé s.a.
nestlé,nestlé s.a.
nestle s.a.,nestlé s.a.
"net design,",net design
netherlands entomological society (netherlands),netherlands entomological society
"netherlands leprosy relief,",netherlands leprosy relief
netwas (kenya),netwas
netwwater - network of women water professionals sri lanka,network of water women professionals
"neuw ventures,",neuw ventures
new america foundation,new america
"new caledonia - association bio caledonia,",caledonian association of biological certification
new caleonia,new caledonia
new dawn engineering (swaziland),new dawn engineering
new energy & industrial technology development org,japan
new energy & industrial technology development org (japan),japan
new energy & industrial technology development org (united states),japan
new england seafood,new england seafoods international ltd
"new horizons,",new horizons
new phytologist trust (united kingdom of great britain and northern ireland),new phytologist trust
new ventures fund,new venture fund
new world hope organization (nwho),new world hope organization
new world hope organization,new world hope organization
new zealand geographical society (new zealand),new zealand geographical society
new zealand ministry for primary industries,new zealand
"new zealand,",new zealand
new-caledonia maritime cluster (cmnc),new caledonia maritime cluster
nexus-carbon for development,nexus carbon for development
ngo committee on sustainable development -ny,ngo committee on sustainable development
ngo fórum do mar fundação grupo boticário,ngo forum of the sea foundation group apothecary
"nielsen,",nielsen
"nigeria,",nigeria
nigerian national petroleum corporation (nigeria),nigerian national petroleum corporation
nike. inc,"nike, inc"
niksa energy associates (nea),niksa energy associates
ningxia cdm service centre (china),ningxia cdm service centre
ningxia province (china),ningxia province
"nippon foundation nereus program, university of british columbia",university of british columbia
nippon foundation-nereus program,nippon foundation
niue island organic farmers association;,niue island organic farmers association
nomadic thought ltd (united kingdom of great britain and northern ireland),nomadic thought ltd
"nordic africa institute (nai),",nordic africa institute
norsk energi (norwegian energy efficiency group) (norway),norsk energi
north american insulation manufacturers association (naima) (united states),north american insulation manufacturers association
north energy associates (united kingdom of great britain and northern ireland),north energy associates
north west university (south africa),north west university
northern marianas,northern mariana islands
northern marianas islands,northern mariana islands
northport (malaysia) bhd.,northport bhd.
"northumbrian water - ondeo services,",northumbrian water - ondeo services
"northumbrian water - ondeo services, (united kingdom of great britain and northern ireland)",northumbrian water - ondeo services
"norway,",norway
norwegian academy of science and letters (norway),norwegian academy of science and letters
norwegian coastal administration •,norwegian coastal administration
norwegian fishing vessel owners association •,norwegian fishing vessel owners association
norwegian maritime authoroty •,norwegian maritime authority
norwegian polar institute (norway),norwegian polar institute
norwegian public roads administration •,norwegian public roads administration
norwegian research council,norwegian research council
norwegian shipowners association,norwegian shipowners’ association
norwest corporation (canada),norwest corporation
norwest corporation (united states),norwest corporation
"novamont ¿ mater.bi s.p.a., novara, italy (italy)",novamont spa
novamont s.p.a.,novamont spa
no-whales-in-captivity,no whales in captivity
nox-fund,nox fund
nox-fund •,nox-fund
npb associates (united states),npb associates
"nrel,",united states
nswma (united states),national solid waste management association
nuclear academics industrial liaison seminar (united kingdom of great britain and northern ireland),city university of london
nuclear research institute rez,nuclear research institute rez
núcleo girassol ecopolíticas e econsciensas,sunflower and ecopolitical nucleus
nuertingen-geislingen university-ngu,nuertingen geislingen university
Nuestra Señora Del Pilar Primary School,Nuestra Señora Del Pilar' Primary School
nv waterwegen en zeekanaal,nv waterways and sea canal
nyathi energy service consultants ltd (south africa),nyathi energy service consultants ltd
o le siosiomaga society inc,o le siosiomaga society incoporated
"o’higgins,",o’higgins
observatoire mediterranéen de l'energie,mediterranean observatory of energy
observatorio pro arrecifes colombia,pro reefs colombia observatory
observatory for cultural and audiovisual communication,unesco
occ: organización para la conservación de cetáceos - uruguay,organization for the conservation of cetaceans
occ: organización para la conservación de cetáceos - uruguay (uruguay),organization for the conservation of cetaceans
ocean 5,oceans 5
"ocean futures society,",ocean futures society
ocean preservation society,oceanic preservation society
oceanário de lisboa,lisbon oceanarium
ocean-conservation-society,ocean conservation society
ocean-first-institute,ocean first institute
"oceania 21,",oceania 21
oceano azul foundation,blue ocean foundation
oceanographic society of japan (osj) (japan),oceanographic society of japan
ocean-revolution,ocean revolution
"ocean-revolution,",ocean revolution
oceanrio de lisboa,oceanário de lisboa
oceans5,oceans 5
ocean-unite,ocean unite
"ocean-unite,",ocean unite
office for disarmament affairs,united nations office for disarmament affairs
"office of the high representative for the least developed countries, landlocked developing countries and small island developing states","united nations office of the high representative for the least developed countries, landlocked developing countries and small island developing states"
office of the united nations high comissioner for human rights,office of the united nations high commissioner for human rights
office of the united nations high commissioner for refugees,united nations high commissioner for refugees
oikon - institute for applied ecology,oikon - institute for applied ecology
oleev group (united states),oleev group
"on think tanks,",on think tanks
"one campaign,",one campaign
one-more-generation,one more generation
ontario ministry of energy (canada),ontario
"open agrifood orléans,",open agrifood orléans
"open data for development network,",open data for development network
"open data institute (odi),",open data institute
"open data watch,",open data watch
"open mena,",open mena
opera di promozione dell'alfabetizzazione net mondo,work to promote net world literacy
operation wallacea,operation wallacea
"orange group,",orange group
"orée,",orée
oregon department of energy,oregon
oregon department of energy (united states),oregon
organisation for economic cooperation and development,organization for economic co-operation and development
organisation for economic co-operation and development,organization for economic co-operation and development
organisation for economic co-operation and development (oecd),organization for economic co-operation and development
"organisation for economic co-operation and development (oecd),",organization for economic co-operation and development
organisation internationale de la francophonie,international organization of francophonie
organisation internationale des constructeurs d'automobiles,international organization of automobile manufacturers
organisation internationale des constructeurs d'automobiles (oica) (france),international organization of automobile manufacturers
Organisation Of American States (United States),Organization of american states
organisation of eastern caribbean states,organization of eastern caribbean states
organismo internacional regional de sanidad agropecuaria (oirsa);,regional international organism for agricultural health
organizacao das cooperativas brasileiras,organization of brazilian cooperatives
organização de cooperação para o desenvolvimento sustentável integrado,cooperation organization for integrated sustainable development
organización conservación de cetáceos/ organization for cetacean conservation occ uruguay,organization for the conservation of cetaceans
organizacion de consumidores y usuarios,organization of consumers and users
organizacion de productores asociados de grandes atuneros congladores,organization of associate producers of large tuna fishing conglomerates
organizacion en california de lidres campesinas,organization in california of peasant land
organizacion para la conservacin de ceteaceos,organization for the conservation of cetaceans
organizatia ecologista neguvernamentala mare nostrum,our large non-governmental environmental organization
organization cetacean conservation occ,organization for the conservation of cetaceans
organization for economic cooperation & development,organization for economic co-operation and development
organization for economic cooperation and development,organization for economic co-operation and development
organization for the conservation of cetaceans,organization for the conservation of cetaceans
organization of african states for cartography & teledetect,organization of african states for cartography and teledetect
organization of economic cooperation and development,organization for economic co-operation and development
organization of economic co-operation and development,organization for economic co-operation and development
organization of petroleum exporting countries,organization of the petroleum exporting countries
organization-for-research-and-conservation-of-aquatic-animals-,organization for research and conservation of aquatic animals
organizzazione di volontariato internazionale cristiano,international christian volunteer organization
"orodata science,",orodata science
orrick,orrick law firm
orvecon (ecuador),orvecon
ospar,ospar commission for the protection of the marine environment of the north east atlantic
ospar commission,ospar commission for the protection of the marine environment of the north east atlantic
osram,osram ag
our native village eco resort (india),our native village eco resort
"ovci,",ovci
overseas development institute (odi) (united kingdom of great britain and northern ireland),overseas development institute
"overseas development institute (odi),",overseas development institute
overseas development institute (united kingdom of great britain and northern ireland),overseas development institute
owens corning (united states),owens corning
oxfam,oxfam international
oxfam america,oxfam america
